[
  {
    "clause_id": "CPA_2019_S1_list_1",
    "parent_section": "CPA_2019_S1",
    "label": "1.",
    "text": "Short title, extent, commencement and application.",
    "clause_type": "list_numbered_list"
  },
  {
    "clause_id": "CPA_2019_S2_list_2",
    "parent_section": "CPA_2019_S2",
    "label": "2.",
    "text": "Definitions.",
    "clause_type": "list_numbered_list"
  },
  {
    "clause_id": "CPA_2019_S3_sent_1",
    "parent_section": "CPA_2019_S3",
    "label": "Sentence 1",
    "text": "The Central Government shall, by notification, establish with effect from such date as it may specify in that notification, the Central Consumer Protection Council to be known as the Central Council.",
    "clause_type": "sentence"
  },
  {
    "clause_id": "CPA_2019_S3_sent_2",
    "parent_section": "CPA_2019_S3",
    "label": "Sentence 2",
    "text": "The Central Council shall be an advisory council and consist of the Minister-in-charge of the Department of Consumer Affairs in the Central Government, who shall be the Chairperson, and such number of other official or non-official members representing such interests as may be prescribed.",
    "clause_type": "sentence"
  },
  {
    "clause_id": "CPA_2019_S4_sent_1",
    "parent_section": "CPA_2019_S4",
    "label": "Sentence 1",
    "text": "The Central Council shall meet as and when necessary, but at least one meeting of the Council shall be held every year.",
    "clause_type": "sentence"
  },
  {
    "clause_id": "CPA_2019_S4_sent_2",
    "parent_section": "CPA_2019_S4",
    "label": "Sentence 2",
    "text": "The Central Council shall meet at such time and place as the Chairperson may think fit and shall observe such procedure in regard to the transaction of its business as may be prescribed.",
    "clause_type": "sentence"
  },
  {
    "clause_id": "CPA_2019_S6_sent_1",
    "parent_section": "CPA_2019_S6",
    "label": "Sentence 1",
    "text": "Every State Government shall, by notification, establish with effect from such date as it may specify in such notification, a State Consumer Protection Council for such State to be known as the State Council.",
    "clause_type": "sentence"
  },
  {
    "clause_id": "CPA_2019_S6_sent_2",
    "parent_section": "CPA_2019_S6",
    "label": "Sentence 2",
    "text": "The State Council shall be an advisory council and consist of the Minister-in-charge of Consumer Affairs in the State Government who shall be the Chairperson, such number of other official or non-official members representing such interests as may be prescribed, and such number of other official or non-official members, not exceeding ten, as may be nominated by the Central Government.",
    "clause_type": "sentence"
  },
  {
    "clause_id": "CPA_2019_S6_sent_3",
    "parent_section": "CPA_2019_S6",
    "label": "Sentence 3",
    "text": "The State Council shall meet as and when necessary but not less than two meetings shall be held every year.",
    "clause_type": "sentence"
  },
  {
    "clause_id": "CPA_2019_S6_sent_4",
    "parent_section": "CPA_2019_S6",
    "label": "Sentence 4",
    "text": "The State Council shall meet at such time and place as the Chairperson may think fit and shall observe such procedure in regard to the transaction of its business as may be prescribed.",
    "clause_type": "sentence"
  },
  {
    "clause_id": "CPA_2019_S8_sent_1",
    "parent_section": "CPA_2019_S8",
    "label": "Sentence 1",
    "text": "The State Government shall, by notification, establish for every district with effect from such date as it may specify in such notification, a District Consumer Protection Council to be known as the District Council.",
    "clause_type": "sentence"
  },
  {
    "clause_id": "CPA_2019_S8_sent_2",
    "parent_section": "CPA_2019_S8",
    "label": "Sentence 2",
    "text": "The District Council shall be an advisory council and consist of the Collector of the district, by whatever name called, who shall be the Chairperson, and such number of other official and non-official members representing such interests as may be prescribed.",
    "clause_type": "sentence"
  },
  {
    "clause_id": "CPA_2019_S8_sent_3",
    "parent_section": "CPA_2019_S8",
    "label": "Sentence 3",
    "text": "The District Council shall meet as and when necessary but not less than two meetings shall be held every year.",
    "clause_type": "sentence"
  },
  {
    "clause_id": "CPA_2019_S8_sent_4",
    "parent_section": "CPA_2019_S8",
    "label": "Sentence 4",
    "text": "The District Council shall meet at such time and place within the district as the Chairperson may think fit and shall observe such procedure in regard to the transaction of its business as may be prescribed.",
    "clause_type": "sentence"
  },
  {
    "clause_id": "CPA_2019_S10_sent_1",
    "parent_section": "CPA_2019_S10",
    "label": "Sentence 1",
    "text": "The Central Government shall, by notification, establish with effect from such date as it may specify in that notification, a Central Consumer Protection Authority to be known as the Central Authority to regulate matters relating to violation of rights of consumers, unfair trade practices and false or misleading advertisements which are prejudicial to the interests of public and consumers and to promote, protect and enforce the rights of consumers as a class.",
    "clause_type": "sentence"
  },
  {
    "clause_id": "CPA_2019_S10_sent_2",
    "parent_section": "CPA_2019_S10",
    "label": "Sentence 2",
    "text": "The Central Authority shall consist of a Chief Commissioner and such number of other Commissioners as may be prescribed, to be appointed by the Central Government to exercise the powers and discharge the functions under this Act.",
    "clause_type": "sentence"
  },
  {
    "clause_id": "CPA_2019_S10_sent_3",
    "parent_section": "CPA_2019_S10",
    "label": "Sentence 3",
    "text": "The headquarters of the Central Authority shall be at such place in the National Capital Region of Delhi, and it shall have regional and other offices in any other place in India as the Central Government may decide.",
    "clause_type": "sentence"
  },
  {
    "clause_id": "CPA_2019_S13_sent_1",
    "parent_section": "CPA_2019_S13",
    "label": "Sentence 1",
    "text": "The Central Government shall provide the Central Authority such number of officers and other employees as it considers necessary for the efficient performance of its functions under this Act.",
    "clause_type": "sentence"
  },
  {
    "clause_id": "CPA_2019_S13_sent_2",
    "parent_section": "CPA_2019_S13",
    "label": "Sentence 2",
    "text": "The salaries and allowances payable to, and the other terms and conditions of service of, the officers and other employees of the Central Authority appointed under this Act shall be such as may be prescribed.",
    "clause_type": "sentence"
  },
  {
    "clause_id": "CPA_2019_S13_sent_3",
    "parent_section": "CPA_2019_S13",
    "label": "Sentence 3",
    "text": "The Central Authority may engage, in accordance with the procedure specified by regulations, such number of experts and professionals of integrity and ability, who have special knowledge and experience in the areas of consumer rights and welfare, consumer policy, law, medicine, food safety, health, engineering, product safety, commerce, economics, public affairs or administration, as it deems necessary to assist it in the discharge of its functions under this Act.",
    "clause_type": "sentence"
  },
  {
    "clause_id": "CPA_2019_S14_sent_1",
    "parent_section": "CPA_2019_S14",
    "label": "Sentence 1",
    "text": "The Central Authority shall regulate the procedure for transaction of its business and allocation of its business amongst the Chief Commissioner and Commissioners as may be specified by regulations.",
    "clause_type": "sentence"
  },
  {
    "clause_id": "CPA_2019_S14_sent_2",
    "parent_section": "CPA_2019_S14",
    "label": "Sentence 2",
    "text": "The Chief Commissioner shall have the powers of general superintendence, direction and control in respect of all administrative matters of the Central Authority and may delegate such of his powers relating to administrative matters of the Central Authority, as he may think fit, to any Commissioner, including a Commissioner of a regional office, or any other officer of the Central Authority.",
    "clause_type": "sentence"
  },
  {
    "clause_id": "CPA_2019_S15_sent_1",
    "parent_section": "CPA_2019_S15",
    "label": "Sentence 1",
    "text": "The Central Authority shall have an Investigation Wing headed by a Director-General for the purpose of conducting inquiry or investigation under this Act as may be directed by the Central Authority.",
    "clause_type": "sentence"
  },
  {
    "clause_id": "CPA_2019_S15_sent_2",
    "parent_section": "CPA_2019_S15",
    "label": "Sentence 2",
    "text": "The Central Government may appoint a Director-General and such number of Additional Director-General, Director, Joint Director, Deputy Director and Assistant Director, from amongst persons who have experience in investigation and possess such qualifications, in such manner, as may be prescribed.",
    "clause_type": "sentence"
  },
  {
    "clause_id": "CPA_2019_S15_sent_3",
    "parent_section": "CPA_2019_S15",
    "label": "Sentence 3",
    "text": "Every Additional Director-General, Director, Joint Director, Deputy Director and Assistant Director shall exercise his powers and discharge his functions subject to the general control, supervision and direction of the Director-General.",
    "clause_type": "sentence"
  },
  {
    "clause_id": "CPA_2019_S15_sent_4",
    "parent_section": "CPA_2019_S15",
    "label": "Sentence 4",